{
    "version": "1.0.0",
    "secret_key": "patient_monitoring_model_secret",
    "root_dir": "patient_monitoring_system",
    "name": "patient_monitoring_system",
    "cmd": "cd patient_monitoring_system/src && python3 app.py",
    "port": 8080,
    "sensor_interface" : "patient_monitoring_system/src/getdata.py",
    "model_interface": "patient_monitoring_system/src/models.json",
    "controller_interface": "patient_monitoring_system/src/sent_msg.py",
    "sensors":[
        {
            "function":"getspo2",
            "sensor_type":"Spo2"
        },
        {
            "function":"getpulserate",
            "sensor_type":"Pulse"
        },
        {
            "function":"gettemperature",
            "sensor_type":"Temperature"
        }
    ],
    "controllers":[
        {
            "function":"send_sms",
            "args":[
                {
                    "name":"phone",
                    "type":"string"
                },
                {
                    "name":"msg",
                    "type":"string"
                }
            ],
            "controller_type":"SMS"
        }
    ],
    "models":["vitals_check","diabetes_check"],
    "health_check":{
        "url":"http://localhost:8080/health",
        "method":"GET",
        "timeout":5
    },
    "requirements": "requirements.txt"
}
